{"currency":"USD","hard_limit":50.0,"incremental_cash_spent":40.12,"ledger_sha256":"de5bf5337a98adf1cbe965c208f53815796aaf742e3178cfecc38a47259c1a00","line_items":[{"amount_usd":39.12,"category":"already_spent_before_durable_campaign"},{"amount_usd":1.0,"category":"durable_campaign_infrastructure_through_evaluation_completion"}],"protocol_id":"gemma4-routed-shared-hybrid-v1-20260728","quota_funded_tpu_chip_seconds":668981.4157924652,"schema_version":"gemma4-routed-shared-hybrid-budget-ledger-v1"}
